{
  "schema_version": 1,
  "node_id": "PCM-101.gateway.vetname.impl",
  "claim_id": "a38c98b5-458b-4fa1-9009-26a1e67eaed0",
  "dispatch_id": "4d95ebee-0bf5-408f-8ec1-1001ca50844d",
  "orchestration_epoch": 0,
  "outcome": "SUBMITTED",
  "commands": [
    {
      "command": [
        "tdd",
        "red"
      ],
      "exit_code": 1
    },
    {
      "command": [
        "tdd",
        "green"
      ],
      "exit_code": 0
    },
    {
      "command": [
        "tdd",
        "regression"
      ],
      "exit_code": 0
    }
  ],
  "commit_sha": "50f221d3c1e24fedb3db20b3fe65c0a0452d82ef",
  "changed_paths": [
    "spring-petclinic-api-gateway/src/test/java/org/springframework/samples/petclinic/api/boundary/web/OwnerDetailsVetNameTest.java",
    "spring-petclinic-api-gateway/src/main/java/org/springframework/samples/petclinic/api/application/VetsServiceClient.java",
    "spring-petclinic-api-gateway/src/main/java/org/springframework/samples/petclinic/api/boundary/web/ApiGatewayController.java",
    "spring-petclinic-api-gateway/src/main/java/org/springframework/samples/petclinic/api/dto/VetDetails.java",
    "spring-petclinic-api-gateway/src/main/java/org/springframework/samples/petclinic/api/dto/VisitDetails.java"
  ],
  "evidence_paths": [],
  "failure_fingerprint": null,
  "decision_request": null,
  "criterion_evidence": [
    {
      "criterion": "AC-5",
      "test_id": "d49388d180525625",
      "gate": "red",
      "output_sha256": "e99e87e71644a6f50db5d73303f999ec299854237d41731164e7a67715789fca"
    },
    {
      "criterion": "AC-6",
      "test_id": "db57d3e470a06614",
      "gate": "red",
      "output_sha256": "e99e87e71644a6f50db5d73303f999ec299854237d41731164e7a67715789fca"
    },
    {
      "criterion": "AC-7",
      "test_id": "175644f4410df49b",
      "gate": "green",
      "output_sha256": "af3ecdc3f6080adaedfb30fe96695671cdbad32256684f5ba76d7b68b0c46912"
    }
  ],
  "tdd": {
    "base_sha": "dc9ca15a71189bc4be6c02518d7180232c0555b7",
    "head_sha": "50f221d3c1e24fedb3db20b3fe65c0a0452d82ef",
    "cycles": [
      {
        "red_commits": [
          "a57cc312cb0aa508902323efd1580125f0cf6e36"
        ],
        "green_commits": [
          "50f221d3c1e24fedb3db20b3fe65c0a0452d82ef"
        ]
      }
    ]
  }
}
